{
  "$schema": "../../schemas/v1.7-connected-transformation-2.schema.json",
  "schemaVersion": 1,
  "contractId": "goreecloud.glaze-ui.v1.7.connected-transformation-2",
  "name": "Glaze UI V1.7 Connected Transformation 2.0 Development Contract",
  "version": "1.7.0-dev.17",
  "lifecycle": "Development",
  "stableBaseline": "1.6.0",
  "consumerEligible": false,
  "planVersion": "v1.2",
  "v12SpecificationSections": [
    25
  ],
  "dependsOn": {
    "signatureTransitionFamiliesVersion": "1.7.0-dev.16",
    "signatureTransitionFamiliesRuntime": "js/glaze-v1.7-signature-transition-families.dev.mjs"
  },
  "connectionOrder": [
    "search-control-to-search-interface",
    "navigation-item-to-destination",
    "app-icon-to-application-surface",
    "card-to-detail-view",
    "thumbnail-to-viewer",
    "quick-setting-to-expanded-setting",
    "compact-player-to-full-player",
    "folder-to-folder-contents",
    "notification-to-related-event",
    "widget-to-expanded-experience",
    "command-result-to-resulting-interface",
    "compact-pane-to-expanded-pane"
  ],
  "connectionPolicy": {
    "search-control-to-search-interface": {
      "identityKind": "object",
      "relationship": "same-object-expansion",
      "family": "Glaze Bloom",
      "platformAppropriatenessRequired": false
    },
    "navigation-item-to-destination": {
      "identityKind": "task",
      "relationship": "source-destination-continuity",
      "family": "Glaze Trace",
      "platformAppropriatenessRequired": false
    },
    "app-icon-to-application-surface": {
      "identityKind": "task",
      "relationship": "source-destination-continuity",
      "family": "Glaze Trace",
      "platformAppropriatenessRequired": true
    },
    "card-to-detail-view": {
      "identityKind": "object",
      "relationship": "same-object-expansion",
      "family": "Glaze Bloom",
      "platformAppropriatenessRequired": false
    },
    "thumbnail-to-viewer": {
      "identityKind": "object",
      "relationship": "same-object-expansion",
      "family": "Glaze Bloom",
      "platformAppropriatenessRequired": false
    },
    "quick-setting-to-expanded-setting": {
      "identityKind": "object",
      "relationship": "same-object-expansion",
      "family": "Glaze Bloom",
      "platformAppropriatenessRequired": false
    },
    "compact-player-to-full-player": {
      "identityKind": "object",
      "relationship": "same-object-expansion",
      "family": "Glaze Bloom",
      "platformAppropriatenessRequired": false
    },
    "folder-to-folder-contents": {
      "identityKind": "task",
      "relationship": "source-destination-continuity",
      "family": "Glaze Trace",
      "platformAppropriatenessRequired": false
    },
    "notification-to-related-event": {
      "identityKind": "task",
      "relationship": "source-destination-continuity",
      "family": "Glaze Trace",
      "platformAppropriatenessRequired": false
    },
    "widget-to-expanded-experience": {
      "identityKind": "object",
      "relationship": "same-object-expansion",
      "family": "Glaze Bloom",
      "platformAppropriatenessRequired": false
    },
    "command-result-to-resulting-interface": {
      "identityKind": "task",
      "relationship": "source-destination-continuity",
      "family": "Glaze Trace",
      "platformAppropriatenessRequired": false
    },
    "compact-pane-to-expanded-pane": {
      "identityKind": "object",
      "relationship": "same-object-expansion",
      "family": "Glaze Bloom",
      "platformAppropriatenessRequired": false
    }
  },
  "requestPolicy": {
    "governedConnectionRequired": true,
    "connectionAuthorityRequired": true,
    "connectionIdentityRequired": true,
    "connectionIdentityAuthorityRequired": true,
    "arbitraryRelationshipRequestAccepted": false,
    "directFamilyRequestAccepted": false,
    "rawChoreographyControlAccepted": false,
    "appSurfaceConnectionRequiresAuthoritativePlatformSupport": true
  },
  "continuity": {
    "preserveIdentityPreferentially": true,
    "sameObjectAndSameTaskSupported": true,
    "unclearIdentityFallsBackToStandardTransition": true,
    "fallbackMustPreserveTask": true,
    "focusOrderPreserved": true,
    "readingOrderPreserved": true,
    "stateDependsOnAnimationCompletion": false,
    "navigationDependsOnAnimationCompletion": false,
    "taskCompletionDependsOnAnimationCompletion": false,
    "interruptibleWhereUserControlled": true
  },
  "authority": {
    "boundary": "presentation-only",
    "connectionRelationshipCreatedByGlaze": false,
    "connectionIdentityCreatedByGlaze": false,
    "platformSupportCreatedByGlaze": false,
    "providerTruthCreatedByGlaze": false,
    "navigationAuthorityCreatedByGlaze": false,
    "actionAuthorityCreatedByGlaze": false,
    "focusAuthorityCreatedByGlaze": false,
    "stateChangedByMotion": false,
    "actionExecutedByMotion": false,
    "navigationExecutedByMotion": false
  },
  "accessibility": {
    "reducedMotionPrecedence": true,
    "reducedMotionUsesStatePreservingEquivalent": true,
    "motionRequiredToUnderstandRelationship": false,
    "focusStateIndependentOfAnimation": true,
    "assistiveTechnologyOrderPreserved": true,
    "accessibilityOutranksExpression": true
  },
  "performance": {
    "progressiveComplexityRequired": true,
    "optionalConnectedMotionMayDegrade": true,
    "degradationMayRemoveRequiredSemantics": false,
    "stateIntegrityRequiredUnderInterruption": true,
    "measuredPerformanceAcceptanceEstablished": false
  },
  "glazeMotionBoundary": {
    "experimentalFoundationVersion": "0.6.0",
    "runtimeCompatibilityBaseline": "0.4.0",
    "experimentalLifecyclePromoted": false,
    "motionStudioPromoted": false,
    "motionSpatialPromoted": false
  },
  "acceptanceBoundary": {
    "sourceFoundationOnly": true,
    "section22Complete": false,
    "section23Complete": false,
    "section24Complete": false,
    "section25Complete": false,
    "connectedTransformationCatalogImplemented": true,
    "renderedAcceptanceEstablished": false,
    "nativePlatformAcceptanceEstablished": false,
    "assistiveTechnologyAcceptanceEstablished": false,
    "performanceAcceptanceEstablished": false,
    "motionFatigueAcceptanceEstablished": false,
    "humanMotionReviewEstablished": false,
    "downstreamConsumerAcceptanceAutomatic": false,
    "releasePromotionAutomatic": false,
    "deploymentAcceptanceAutomatic": false,
    "productionAcceptanceAutomatic": false
  },
  "runtimeEntrypoint": "js/glaze-v1.7-connected-transformation-2.dev.mjs",
  "developmentAggregateEntrypoint": "js/glaze-v1.7-development.mjs",
  "tokenMap": "tokens/glaze-v1.7-connected-transformation-2.dev.json",
  "sourceAuthorities": [
    "GLAZE_UI_V1_7_PLANNED.md",
    "PLANNED-FEATURES.md",
    "IMPLEMENTED-FEATURES.md",
    "CHANGELOGS.md"
  ]
}
